{
  "ir_version": "1",
  "nodes": [
    { "id": "start", "type": "start", "title": "开始", "inputs": [], "outputs": [{ "name": "workflow_input", "data_type": "object" }] },
    {
      "id": "all_literal_types",
      "type": "code",
      "title": "六种 Literal",
      "inputs": [
        { "name": "source_code", "data_type": "string", "source": "literal", "value": "def main(inputs):\n    return {}" },
        { "name": "text_value", "data_type": "string", "source": "literal", "value": "frog" },
        { "name": "integer_value", "data_type": "integer", "source": "literal", "value": 42 },
        { "name": "number_value", "data_type": "number", "source": "literal", "value": 42.5 },
        { "name": "boolean_value", "data_type": "boolean", "source": "literal", "value": true },
        { "name": "object_value", "data_type": "object", "source": "literal", "value": { "nullable": null } },
        { "name": "array_value", "data_type": "array", "source": "literal", "value": [1, null, "x"] }
      ],
      "outputs": []
    },
    { "id": "end", "type": "end", "title": "结束", "inputs": [{ "name": "workflow_output", "data_type": "object", "source": "literal", "value": {} }], "outputs": [] }
  ],
  "edges": [{ "id": "start_to_literals", "source": "start", "target": "all_literal_types" }, { "id": "literals_to_end", "source": "all_literal_types", "target": "end" }],
  "layout": { "start": { "x": 0, "y": 0 }, "all_literal_types": { "x": 1, "y": 0 }, "end": { "x": 2, "y": 0 } }
}
