{
  "ir_version": "1",
  "nodes": [
    { "id": "start", "type": "start", "title": "开始", "inputs": [], "outputs": [{ "name": "workflow_input", "data_type": "object" }] },
    {
      "id": "normalize_order",
      "type": "code",
      "title": "规范化订单",
      "inputs": [
        { "name": "source_code", "data_type": "string", "source": "literal", "value": "def main(inputs):\n    return {'result': inputs['order']}" },
        { "name": "order", "data_type": "object", "source": "ref", "ref_node": "start", "ref_output": "workflow_input" }
      ],
      "outputs": [{ "name": "result", "data_type": "object" }]
    },
    { "id": "end", "type": "end", "title": "结束", "inputs": [{ "name": "workflow_output", "data_type": "object", "source": "ref", "ref_node": "normalize_order", "ref_output": "result" }], "outputs": [] }
  ],
  "edges": [
    { "id": "start_to_normalize_order", "source": "start", "target": "normalize_order" },
    { "id": "normalize_order_to_end", "source": "normalize_order", "target": "end" }
  ],
  "layout": {
    "start": { "x": 80, "y": 160 },
    "normalize_order": { "x": 320, "y": 160 },
    "end": { "x": 560, "y": 160 }
  }
}
